<?xml version='1.0' encoding='utf-8'?>
<!DOCTYPE location SYSTEM "location.dtd" [
    
]>
<location width="20" height="20" random="0.3">
		
	<player x="4.5" y="3.5" z="2" rotz="1.3">
		<item type="weapon" name="knife" equiped="yes"/>
	</player>

<!--	
	<phasemap widthx="3">
		<phasex widthy="5">
			<phasey height="2">
				<phase type="water"/>
				<phase type="water"/>
			</phasey>
			<phasey>
				<phase type="solid"/>
			</phasey>
			<phasey height="2">
				<phase type="water"/>
				<phase type="water"/>
			</phasey>
			<phasey>
				<phase type="solid"/>
			</phasey>
			<phasey height="2">
				<phase type="water"/>
				<phase type="water"/>
			</phasey>
		</phasex>
		<phasex widthy="5">
			<phasey height="2">
				<phase type="water"/>
				<phase type="water"/>
			</phasey>
			<phasey>
				<phase type="solid"/>
			</phasey>
			<phasey height="2">
				<phase type="water"/>
				<phase type="water"/>
			</phasey>
			<phasey>
				<phase type="solid"/>
			</phasey>
			<phasey height="2">
				<phase type="water"/>
				<phase type="water"/>
			</phasey>
		</phasex>
		<phasex widthy="5">
			<phasey height="2">
				<phase type="water"/>
				<phase type="water"/>
			</phasey>
			<phasey>
				<phase type="solid"/>
			</phasey>
			<phasey height="2">
				<phase type="water"/>
				<phase type="water"/>
			</phasey>
			<phasey>
				<phase type="solid"/>
			</phasey>
			<phasey height="2">
				<phase type="water"/>
				<phase type="water"/>
			</phasey>
		</phasex>
	</phasemap>
	-->
	<tree x="11.0" y="6.0"/>
	<tree x="6.3" y="8.0"/>
	<tree x="9.0" y="8.5"/>
	<tree x="7.0" y="10.0"/>
	<tree x="10.0" y="7.0"/>
	<tree x="9.0" y="7.0"/>
	
	<house x="7" y="7.2" rotz="1.3"/>
	
	<house x="12" y="7.2" rotz="2.3"/>
	
	<house x="7" y="13.2" rotz="3.3"/>
	
		
	<darkball x="9.0" y="8.2" z="2" rotz="1.3">
		<item type="weapon" name="oldknife" equiped="no"/>
	</darkball>
		
	<darkball x="7" y="7.2" z="2" rotz="1.3"/>
		
	<darkball x="9.0" y="8.2" z="2" rotz="1.3">
		<item type="weapon" name="oldknife" equiped="no"/>
	</darkball>
		
	<darkball x="7" y="7.2" z="2" rotz="1.3"/>
	
	<darkball x="9.0" y="8.2" z="2" rotz="1.3">
		<item type="weapon" name="oldknife" equiped="no"/>
	</darkball>
		
	<darkball x="7" y="7.2" z="2" rotz="1.3"/>
	
</location>